Sender: LSF System <lsfadmin@polus-c3-ib.bmc.hpc.cs.msu.ru>
Subject: Job 1346354: <sol1_p16_40x40_part3> in cluster <MSUCluster> Done

Job <sol1_p16_40x40_part3> was submitted from host <polus-ib.bmc.hpc.cs.msu.ru> by user <edu-cmc-skmodel25-616-10> in cluster <MSUCluster> at Sun Nov 23 17:50:30 2025
Job was executed on host(s) <polus-c3-ib.bmc.hpc.cs.msu.ru>, in queue <normal>, as user <edu-cmc-skmodel25-616-10> in cluster <MSUCluster> at Sun Nov 23 17:51:32 2025
</home_edu/edu-cmc-skmodel25-616/edu-cmc-skmodel25-616-10> was used as the home directory.
</home_edu/edu-cmc-skmodel25-616/edu-cmc-skmodel25-616-10> was used as the working directory.
Started at Sun Nov 23 17:51:32 2025
Terminated at Sun Nov 23 17:51:34 2025
Results reported at Sun Nov 23 17:51:34 2025

Your job looked like:

------------------------------------------------------------
# LSBATCH: User input
#BSUB -J sol1_p16_40x40_part3
#BSUB -n 1 -q normal
#BSUB -W 00:10
#BSUB -o ./log/part3-40x40-p16.out
#BSUB -e ./log/part3-40x40-p16.err
#BSUB -R "span[hosts=1]"
OMP_NUM_THREADS=16 ./sol1 40 40

------------------------------------------------------------

Successfully completed.

Resource usage summary:

    CPU time :                                   0.13 sec.
    Max Memory :                                 3 MB
    Average Memory :                             1.67 MB
    Total Requested Memory :                     -
    Delta Memory :                               -
    Max Swap :                                   -
    Max Processes :                              1
    Max Threads :                                1
    Run time :                                   2 sec.
    Turnaround time :                            64 sec.

The output (if any) follows:

iter=     0  |r|/|b|=4.531842872  |r|=140.6440798
iter=    50  |r|/|b|=0.02176011118  |r|=0.6753170618
iter=   100  |r|/|b|=3.4278864e-06  |r|=0.0001063831959
final |r|/|b|=9.801535517e-09
solve time: 0.006408445537 s
iterations: 123


PS:

Read file <./log/part3-40x40-p16.err> for stderr output of this job.

Sender: LSF System <lsfadmin@polus-c3-ib.bmc.hpc.cs.msu.ru>
Subject: Job 1346654: <sol1_p16_40x40_part3> in cluster <MSUCluster> Done

Job <sol1_p16_40x40_part3> was submitted from host <polus-ib.bmc.hpc.cs.msu.ru> by user <edu-cmc-skmodel25-616-10> in cluster <MSUCluster> at Sun Nov 23 18:51:56 2025
Job was executed on host(s) <polus-c3-ib.bmc.hpc.cs.msu.ru>, in queue <normal>, as user <edu-cmc-skmodel25-616-10> in cluster <MSUCluster> at Sun Nov 23 18:52:56 2025
</home_edu/edu-cmc-skmodel25-616/edu-cmc-skmodel25-616-10> was used as the home directory.
</home_edu/edu-cmc-skmodel25-616/edu-cmc-skmodel25-616-10> was used as the working directory.
Started at Sun Nov 23 18:52:56 2025
Terminated at Sun Nov 23 18:52:57 2025
Results reported at Sun Nov 23 18:52:57 2025

Your job looked like:

------------------------------------------------------------
# LSBATCH: User input
#BSUB -J sol1_p16_40x40_part3
#BSUB -n 1 -q normal
#BSUB -W 00:10
#BSUB -o ./log/part3-40x40-p16.out
#BSUB -e ./log/part3-40x40-p16.err
#BSUB -R "span[hosts=1]"
OMP_NUM_THREADS=16 ./sol1 40 40

------------------------------------------------------------

Successfully completed.

Resource usage summary:

    CPU time :                                   0.13 sec.
    Max Memory :                                 3 MB
    Average Memory :                             1.67 MB
    Total Requested Memory :                     -
    Delta Memory :                               -
    Max Swap :                                   -
    Max Processes :                              1
    Max Threads :                                1
    Run time :                                   1 sec.
    Turnaround time :                            61 sec.

The output (if any) follows:

iter=     0  |r|/|b|=4.531842872  |r|=140.6440798
iter=    50  |r|/|b|=0.02176011118  |r|=0.6753170618
iter=   100  |r|/|b|=3.4278864e-06  |r|=0.0001063831959
final |r|/|b|=9.801535517e-09
solve time: 0.00613457337 s
iterations: 123


PS:

Read file <./log/part3-40x40-p16.err> for stderr output of this job.

Sender: LSF System <lsfadmin@polus-c3-ib.bmc.hpc.cs.msu.ru>
Subject: Job 1346674: <sol1_p16_40x40_part3> in cluster <MSUCluster> Done

Job <sol1_p16_40x40_part3> was submitted from host <polus-ib.bmc.hpc.cs.msu.ru> by user <edu-cmc-skmodel25-616-10> in cluster <MSUCluster> at Sun Nov 23 18:51:58 2025
Job was executed on host(s) <polus-c3-ib.bmc.hpc.cs.msu.ru>, in queue <normal>, as user <edu-cmc-skmodel25-616-10> in cluster <MSUCluster> at Sun Nov 23 18:54:09 2025
</home_edu/edu-cmc-skmodel25-616/edu-cmc-skmodel25-616-10> was used as the home directory.
</home_edu/edu-cmc-skmodel25-616/edu-cmc-skmodel25-616-10> was used as the working directory.
Started at Sun Nov 23 18:54:09 2025
Terminated at Sun Nov 23 18:54:10 2025
Results reported at Sun Nov 23 18:54:10 2025

Your job looked like:

------------------------------------------------------------
# LSBATCH: User input
#BSUB -J sol1_p16_40x40_part3
#BSUB -n 1 -q normal
#BSUB -W 00:10
#BSUB -o ./log/part3-40x40-p16.out
#BSUB -e ./log/part3-40x40-p16.err
#BSUB -R "span[hosts=1]"
OMP_NUM_THREADS=16 ./sol1 40 40

------------------------------------------------------------

Successfully completed.

Resource usage summary:

    CPU time :                                   0.13 sec.
    Max Memory :                                 4 MB
    Average Memory :                             3.00 MB
    Total Requested Memory :                     -
    Delta Memory :                               -
    Max Swap :                                   -
    Max Processes :                              2
    Max Threads :                                3
    Run time :                                   1 sec.
    Turnaround time :                            132 sec.

The output (if any) follows:

iter=     0  |r|/|b|=4.531842872  |r|=140.6440798
iter=    50  |r|/|b|=0.02176011118  |r|=0.6753170618
iter=   100  |r|/|b|=3.4278864e-06  |r|=0.0001063831959
final |r|/|b|=9.801535517e-09
solve time: 0.006221979856 s
iterations: 123


PS:

Read file <./log/part3-40x40-p16.err> for stderr output of this job.

